<?xml version="1.0" encoding="UTF-8"?>

<Capacity xmlns:xsi="http://www.w3.org/2001/XMLSchema-instance" version="1.0" xsi:noNamespaceSchemaLocation="../../../schema/Resource.xsd">  
  
    <GlobalMetricSetting isEncrypt="TRUE"> 
    
        <GlobalIsEdit>false</GlobalIsEdit>  
    
        <GlobalIsMonitor>true</GlobalIsMonitor>  
    
        <GlobalDefaultMonitorFreq>day1</GlobalDefaultMonitorFreq>  
    
        <GlobalsupportMonitorFreq>min1,min5,min10,hour1,day1</GlobalsupportMonitorFreq>  
    
        <GlobalIsAlert>true</GlobalIsAlert>  
    
        <GlobalDefaultFlapping>1</GlobalDefaultFlapping> 
  
    </GlobalMetricSetting>  
  
    <Resource id="SklXU0d4Mk1Ram1Tb2dSTkkvY2svdz09" category="N0k3NUNzS2lGU3htZUpuc05jZHBBQT09" icon="NjEvYkpXV0FCM1k1SE9kZXlXbHFuUT09" name="SSH/Telnet" description="进程"> 
    
        <Metrics> 
      
            <Metric id="NFRRT3BMeEFmd3BkMWtsMEFYNEc0dz09" style="TDBUaHMrK3BZWXlhQmZoVXFZZERjenZjUUNzRDFFc09TRjVJUVVHUXpnYz0=" name="进程ID" description="进程ID" unit=""> 
        
                <IsDisplay displayOrder="UmhGRWpua2R6SURZaWpidXVBN2Nxdz09">VlQ1MENXQzVkMjFRUHpXK3BJQ0lvQT09</IsDisplay>  
        
                <IsMonitor>SDRSWWdMQkdmdmZiTlU0OXdaMkhtQT09</IsMonitor>  
        
                <IsEdit>VlQ1MENXQzVkMjFRUHpXK3BJQ0lvQT09</IsEdit>  
        
                <DefaultMonitorFreq>NHVBL0Y0NmhkYU50WHNzditxS3hYUT09</DefaultMonitorFreq>  
        
                <SupportMonitorFreq>SHNiL3VCVUVqMXVJSjFRdG1XaDNuQT09</SupportMonitorFreq>  
        
                <IsAlert>VlQ1MENXQzVkMjFRUHpXK3BJQ0lvQT09</IsAlert>  
        
                <DefaultFlapping>Z0w4SHRMSE00Y3NrTmVrcUwvallndz09</DefaultFlapping> 
      
            </Metric>
        
      
            <Metric id="K3A5eVhNYXd6RFpCeWlmVFY0bnJsQT09" style="TDBUaHMrK3BZWXlhQmZoVXFZZERjenZjUUNzRDFFc09TRjVJUVVHUXpnYz0=" name="进程名称" description="进程名称" unit=""> 
        
                <IsDisplay displayOrder="S0pnRThsN2pYR1piemxHL3VqMzhMQT09">VlQ1MENXQzVkMjFRUHpXK3BJQ0lvQT09</IsDisplay>  
        
                <IsMonitor>VlQ1MENXQzVkMjFRUHpXK3BJQ0lvQT09</IsMonitor>  
        
                <IsEdit>VlQ1MENXQzVkMjFRUHpXK3BJQ0lvQT09</IsEdit>  
        
                <DefaultMonitorFreq>NHVBL0Y0NmhkYU50WHNzditxS3hYUT09</DefaultMonitorFreq>  
        
                <SupportMonitorFreq>SHNiL3VCVUVqMXVJSjFRdG1XaDNuQT09</SupportMonitorFreq>  
        
                <IsAlert>VlQ1MENXQzVkMjFRUHpXK3BJQ0lvQT09</IsAlert>  
        
                <DefaultFlapping>Z0w4SHRMSE00Y3NrTmVrcUwvallndz09</DefaultFlapping> 
      
            </Metric>
      
      
            <Metric id="Zk5lb0pYU01acTR6MVAzYUUzazRmZz09" style="TDBUaHMrK3BZWXlhQmZoVXFZZERjenZjUUNzRDFFc09TRjVJUVVHUXpnYz0=" name="IP地址" description="IP地址" unit="">
      	
                <IsDisplay displayOrder="azBBajMzZ3FFeG9CRjcwOTZPL0lPUT09">SDRSWWdMQkdmdmZiTlU0OXdaMkhtQT09</IsDisplay>
      	
                <IsMonitor>VlQ1MENXQzVkMjFRUHpXK3BJQ0lvQT09</IsMonitor>
      	
                <IsEdit>VlQ1MENXQzVkMjFRUHpXK3BJQ0lvQT09</IsEdit>
      	
                <DefaultMonitorFreq>NHVBL0Y0NmhkYU50WHNzditxS3hYUT09</DefaultMonitorFreq>  
        
                <SupportMonitorFreq>SHNiL3VCVUVqMXVJSjFRdG1XaDNuQT09</SupportMonitorFreq>  
        
                <IsAlert>VlQ1MENXQzVkMjFRUHpXK3BJQ0lvQT09</IsAlert>  
        
                <DefaultFlapping>Z0w4SHRMSE00Y3NrTmVrcUwvallndz09</DefaultFlapping> 
      
            </Metric>
        
      
            <Metric id="bkVRdlhKd2d5bTNtb0ZKQ29kT1o5dz09" style="VzFQeGN6MkhDZTF5VVNhVVVELzR4RFpDUTQ3c2FXaEl4MDI0SjRyYi9hQT0=" name="进程状态" description="进程状态" unit=""> 
        
                <IsDisplay displayOrder="N1hzWURLbUYrRmFrU3NlQUdPUU9ydz09">SDRSWWdMQkdmdmZiTlU0OXdaMkhtQT09</IsDisplay>  
        
                <IsMonitor>SDRSWWdMQkdmdmZiTlU0OXdaMkhtQT09</IsMonitor>  
        
                <IsEdit>VlQ1MENXQzVkMjFRUHpXK3BJQ0lvQT09</IsEdit>  
        
                <DefaultMonitorFreq>Q3g5Tk1ySnFkWEJEYjN1Smx4NWlyQT09</DefaultMonitorFreq>  
        
                <SupportMonitorFreq>MGUvWmNTd1Mxai83anlydzFmeWtQVzlRSEs2aEdhNVFJVFlnVmhjWkppS0F2d2Uwc2N6aHl5UTE2U292K05pRA==</SupportMonitorFreq>  
        
                <IsAlert>SDRSWWdMQkdmdmZiTlU0OXdaMkhtQT09</IsAlert>  
        
                <DefaultFlapping>ZHdHVHJXSS9HN1F4UUZFOTMyam1Qdz09</DefaultFlapping> 
      
            </Metric>
       
      
            <Metric id="NTBZV0U2NTBITUQyL2RQVWhneUtRdz09" style="Vkc4US95bjkrMFVTYm16RjBzeWtMenZjUUNzRDFFc09TRjVJUVVHUXpnYz0=" name="进程CPU利用率" description="进程CPU利用率" unit="%"> 
        
                <IsDisplay displayOrder="NStlQzNGZVdNdzRIVkRUcE5nS1pVZz09">SDRSWWdMQkdmdmZiTlU0OXdaMkhtQT09</IsDisplay>  
        
                <IsMonitor>SDRSWWdMQkdmdmZiTlU0OXdaMkhtQT09</IsMonitor>  
        
                <IsEdit>VlQ1MENXQzVkMjFRUHpXK3BJQ0lvQT09</IsEdit>  
        
                <DefaultMonitorFreq>TmpOT294bXcxcU9kL25HWkJ3bHQ4QT09</DefaultMonitorFreq>  
        
                <SupportMonitorFreq>dWdaOUk3Zk9FY1V0ZWhURE5zNWhwWWhaeStvaWQzMitnUWllR1FieTMwOExrUlQ0WWRrWEZXU3ZDRWo4QWl3QQ==</SupportMonitorFreq>  
        
                <IsAlert>VlQ1MENXQzVkMjFRUHpXK3BJQ0lvQT09</IsAlert>  
        
                <DefaultFlapping>Z0w4SHRMSE00Y3NrTmVrcUwvallndz09</DefaultFlapping>  
        
                <Thresholds> 
          
                    <Threshold operator="&lt;" defaultvalue="TFRoRnZuWXVEb09Ha1UzTXhmNlgwZz09" stateid="RUVYZjB6T2Iyc0xoQlF3NGNPN1NJdz09"/>  
          
                    <Threshold operator="&gt;=" defaultvalue="TFRoRnZuWXVEb09Ha1UzTXhmNlgwZz09" stateid="WkFkWXZpYksrNk9KeTc0VnRNeWd0QT09"/>  
          
                    <Threshold operator="&gt;=" defaultvalue="anY5QjVWaUdvd1FoSVNEN3NyVUhJdz09" stateid="dHdtUDg2T1FjR2RVN1BoR3dMd2EzUT09"/> 
        
                </Thresholds> 
      
            </Metric>  
      
      
            <Metric id="TmkvOWtlS0ttZ3BJREdVT3lnMThNdz09" style="Vkc4US95bjkrMFVTYm16RjBzeWtMenZjUUNzRDFFc09TRjVJUVVHUXpnYz0=" name="进程内存利用率" description="进程内存利用率" unit="%"> 
        
                <IsDisplay displayOrder="N0NONEJjbm9XK3ZKM0lsaktEakxyQT09">SDRSWWdMQkdmdmZiTlU0OXdaMkhtQT09</IsDisplay>  
        
                <IsMonitor>SDRSWWdMQkdmdmZiTlU0OXdaMkhtQT09</IsMonitor>  
        
                <IsEdit>VlQ1MENXQzVkMjFRUHpXK3BJQ0lvQT09</IsEdit>  
        
                <DefaultMonitorFreq>TmpOT294bXcxcU9kL25HWkJ3bHQ4QT09</DefaultMonitorFreq>  
        
                <SupportMonitorFreq>dWdaOUk3Zk9FY1V0ZWhURE5zNWhwWWhaeStvaWQzMitnUWllR1FieTMwOExrUlQ0WWRrWEZXU3ZDRWo4QWl3QQ==</SupportMonitorFreq>  
        
                <IsAlert>VlQ1MENXQzVkMjFRUHpXK3BJQ0lvQT09</IsAlert>  
        
                <DefaultFlapping>Z0w4SHRMSE00Y3NrTmVrcUwvallndz09</DefaultFlapping>  
        
                <Thresholds> 
          
                    <Threshold operator="&lt;" defaultvalue="TFRoRnZuWXVEb09Ha1UzTXhmNlgwZz09" stateid="RUVYZjB6T2Iyc0xoQlF3NGNPN1NJdz09"/>  
          
                    <Threshold operator="&gt;=" defaultvalue="TFRoRnZuWXVEb09Ha1UzTXhmNlgwZz09" stateid="WkFkWXZpYksrNk9KeTc0VnRNeWd0QT09"/>  
          
                    <Threshold operator="&gt;=" defaultvalue="anY5QjVWaUdvd1FoSVNEN3NyVUhJdz09" stateid="dHdtUDg2T1FjR2RVN1BoR3dMd2EzUT09"/> 
        
                </Thresholds> 
      
            </Metric>  
      
            <!-- <Metric id="procMulStat" style="InformationMetric" name="进程状态" description="进程状态" unit=""> 
        <IsDisplay displayOrder="2039">true</IsDisplay>  
        <IsMonitor>true</IsMonitor>  
        <IsEdit>false</IsEdit>  
        <DefaultMonitorFreq>day1</DefaultMonitorFreq>  
        <SupportMonitorFreq>hour1,day1</SupportMonitorFreq>  
        <IsAlert>true</IsAlert>  
        <DefaultFlapping>1</DefaultFlapping> 
      </Metric>  --> 
      
            <Metric id="THNLdjVDS2xFQ253L1VLclN6ODJNUT09" style="TDBUaHMrK3BZWXlhQmZoVXFZZERjenZjUUNzRDFFc09TRjVJUVVHUXpnYz0=" name="进程开始时间" description="进程开始时间" unit=""> 
        
                <IsDisplay displayOrder="My9JQzU4aGs3empReVdEMXpmT2puUT09">SDRSWWdMQkdmdmZiTlU0OXdaMkhtQT09</IsDisplay>  
        
                <IsMonitor>SDRSWWdMQkdmdmZiTlU0OXdaMkhtQT09</IsMonitor>  
        
                <IsEdit>VlQ1MENXQzVkMjFRUHpXK3BJQ0lvQT09</IsEdit>  
        
                <DefaultMonitorFreq>NHVBL0Y0NmhkYU50WHNzditxS3hYUT09</DefaultMonitorFreq>  
        
                <SupportMonitorFreq>SHNiL3VCVUVqMXVJSjFRdG1XaDNuQT09</SupportMonitorFreq>  
        
                <IsAlert>VlQ1MENXQzVkMjFRUHpXK3BJQ0lvQT09</IsAlert>  
        
                <DefaultFlapping>Z0w4SHRMSE00Y3NrTmVrcUwvallndz09</DefaultFlapping> 
      
            </Metric> 
    
        </Metrics>  
    
        <Properties> 
      
            <Property id="NFRRT3BMeEFmd3BkMWtsMEFYNEc0dz09" name="processId" metricid="NFRRT3BMeEFmd3BkMWtsMEFYNEc0dz09"/>  
      
            <Property id="K3A5eVhNYXd6RFpCeWlmVFY0bnJsQT09" name="processCommand" metricid="K3A5eVhNYXd6RFpCeWlmVFY0bnJsQT09"/> 
    
        </Properties>
    
        <Instantiation InstanceId="bUNNYWNjUXZzSGRlWUJBUzM3VHJWUVlPMmh5Sy9iamh5Zlh6cm84MTJFUT0=" InstanceName="K3A5eVhNYXd6RFpCeWlmVFY0bnJsQT09"/>   
  
    </Resource> 
</Capacity>