<?xml version="1.0" encoding="UTF-8"?>

<Capacity xmlns:xsi="http://www.w3.org/2001/XMLSchema-instance" version="1.0" xsi:noNamespaceSchemaLocation="../../../schema/Resource.xsd">
    <SupportInfo>
        <SupportName>CICS</SupportName>
        <PreSupportVersion>CICS 7.1</PreSupportVersion>
        <ActualSupportVersion>CICS 7.1/SCO Unixware</ActualSupportVersion>
    </SupportInfo>
    <GlobalMetricSetting isEncrypt="FALSE" version="4.1.0">
        <GlobalIsEdit>false</GlobalIsEdit>
        <GlobalIsMonitor>true</GlobalIsMonitor>
        <GlobalDefaultMonitorFreq>day1</GlobalDefaultMonitorFreq>
        <GlobalsupportMonitorFreq>min1,min5,min10,hour1,day1</GlobalsupportMonitorFreq>
        <GlobalIsAlert>true</GlobalIsAlert>
        <GlobalDefaultFlapping>1</GlobalDefaultFlapping>
    </GlobalMetricSetting>
    <Resource id="MWCICS" category="CICS" icon="MWCICS.png" name="CICS Client" description="CICS Client">
        <Metrics>
            <Metric id="icmpDelayTime" style="PerformanceMetric" name="响应时间" description="响应时间" unit="ms">
                <IsDisplay displayOrder="1030">true</IsDisplay>
                <IsMonitor>true</IsMonitor>
                <IsEdit>false</IsEdit>
                <DefaultMonitorFreq>min5</DefaultMonitorFreq>
                <SupportMonitorFreq>min1,min5,min10,min30,hour1,hour4,hour8</SupportMonitorFreq>
                <IsAlert>false</IsAlert>
                <DefaultFlapping>1</DefaultFlapping>
                <Thresholds>
                    <Threshold operator="&lt;" defaultvalue="500" stateid="Normal"/>
                    <Threshold operator="&gt;" defaultvalue="1000" stateid="Minor"/>
                    <Threshold operator="&gt;" defaultvalue="5000" stateid="Major"/>
                </Thresholds>
            </Metric>
            <Metric id="cpuRate" style="PerformanceMetric" name="CPU利用率" description="CPU利用率" unit="%">
                <IsDisplay displayOrder="1400">true</IsDisplay>
                <IsMonitor>true</IsMonitor>
                <IsEdit>false</IsEdit>
                <DefaultMonitorFreq>min5</DefaultMonitorFreq>
                <SupportMonitorFreq>min1,min5,min10,min30,hour1,hour4,hour8</SupportMonitorFreq>
                <IsAlert>false</IsAlert>
                <DefaultFlapping>1</DefaultFlapping>
                <Thresholds>
                    <Threshold operator="&lt;" defaultvalue="90" stateid="Normal"/>
                    <Threshold operator="&gt;=" defaultvalue="90" stateid="Minor"/>
                    <Threshold operator="&gt;=" defaultvalue="95" stateid="Major"/>
                </Thresholds>
            </Metric>
            <Metric id="memRate" style="PerformanceMetric" name="内存利用率" description="内存利用率" unit="%">
                <IsDisplay displayOrder="2500">true</IsDisplay>
                <IsMonitor>true</IsMonitor>
                <IsEdit>false</IsEdit>
                <DefaultMonitorFreq>min5</DefaultMonitorFreq>
                <SupportMonitorFreq>min1,min5,min10,min30,hour1,hour4,hour8</SupportMonitorFreq>
                <IsAlert>false</IsAlert>
                <DefaultFlapping>1</DefaultFlapping>
                <Thresholds>
                    <Threshold operator="&lt;" defaultvalue="90" stateid="Normal"/>
                    <Threshold operator="&gt;=" defaultvalue="90" stateid="Minor"/>
                    <Threshold operator="&gt;=" defaultvalue="95" stateid="Major"/>
                </Thresholds>
            </Metric>
            <Metric id="OperatingSystem" style="InformationMetric" name="操作系统" description="操作系统" unit="">
                <IsDisplay displayOrder="110">true</IsDisplay>
                <IsMonitor>true</IsMonitor>
                <IsEdit>false</IsEdit>
                <DefaultMonitorFreq>day1</DefaultMonitorFreq>
                <SupportMonitorFreq>hour1,day1</SupportMonitorFreq>
                <IsAlert>false</IsAlert>
                <DefaultFlapping>1</DefaultFlapping>
            </Metric>
            <Metric id="hostName" style="InformationMetric" name="主机名称" description="主机名称" unit="">
                <IsDisplay displayOrder="100">true</IsDisplay>
                <IsMonitor>true</IsMonitor>
                <IsEdit>false</IsEdit>
                <DefaultMonitorFreq>day1</DefaultMonitorFreq>
                <SupportMonitorFreq>hour1,day1</SupportMonitorFreq>
                <IsAlert>false</IsAlert>
                <DefaultFlapping>1</DefaultFlapping>
            </Metric>
            <Metric id="totalMemSize" style="InformationMetric" name="内存总容量" description="内存大小" unit="KB">
                <IsDisplay displayOrder="600">true</IsDisplay>
                <IsMonitor>true</IsMonitor>
                <IsEdit>false</IsEdit>
                <DefaultMonitorFreq>day1</DefaultMonitorFreq>
                <SupportMonitorFreq>hour1,day1</SupportMonitorFreq>
                <IsAlert>false</IsAlert>
                <DefaultFlapping>1</DefaultFlapping>
            </Metric>
            <Metric id="availability" style="AvailabilityMetric" name="CICS服务可用性" description="CICS服务可用性" unit="">
                <IsDisplay displayOrder="50">true</IsDisplay>
                <IsMonitor>true</IsMonitor>
                <IsEdit>false</IsEdit>
                <DefaultMonitorFreq>min1</DefaultMonitorFreq>
                <SupportMonitorFreq>sec30,min1,min5,min10,min30,hour1</SupportMonitorFreq>
                <IsAlert>true</IsAlert>
                <DefaultFlapping>2</DefaultFlapping>
            </Metric>
            <Metric id="appCpuRate" style="PerformanceMetric" name="CICS CPU利用率" description="CICS CPU利用率" unit="%">
                <IsDisplay displayOrder="1500">true</IsDisplay>
                <IsMonitor>true</IsMonitor>
                <IsEdit>false</IsEdit>
                <DefaultMonitorFreq>min5</DefaultMonitorFreq>
                <SupportMonitorFreq>min1,min5,min10,min30,hour1,hour4,hour8</SupportMonitorFreq>
                <IsAlert>false</IsAlert>
                <DefaultFlapping>1</DefaultFlapping>
                <Thresholds>
                    <Threshold operator="&lt;" defaultvalue="90" stateid="Normal"/>
                    <Threshold operator="&gt;=" defaultvalue="90" stateid="Minor"/>
                    <Threshold operator="&gt;=" defaultvalue="95" stateid="Major"/>
                </Thresholds>
            </Metric>
            <Metric id="appMemRate" style="PerformanceMetric" name="CICS 内存利用率" description="CICS 内存利用率" unit="%">
                <IsDisplay displayOrder="2600">true</IsDisplay>
                <IsMonitor>true</IsMonitor>
                <IsEdit>false</IsEdit>
                <DefaultMonitorFreq>min5</DefaultMonitorFreq>
                <SupportMonitorFreq>min1,min5,min10,min30,hour1,hour4,hour8</SupportMonitorFreq>
                <IsAlert>false</IsAlert>
                <DefaultFlapping>1</DefaultFlapping>
                <Thresholds>
                    <Threshold operator="&lt;" defaultvalue="90" stateid="Normal"/>
                    <Threshold operator="&gt;=" defaultvalue="90" stateid="Minor"/>
                    <Threshold operator="&gt;=" defaultvalue="95" stateid="Major"/>
                </Thresholds>
            </Metric>
        </Metrics>
        <Properties>
            <Property id="hostName" name="hostName" metricid="hostName"/>
            <Property id="availability" name="availability" metricid="availability"/>
            <Property id="totalMemSize" name="totalMemSize" metricid="totalMemSize"/>
        </Properties>
        <Instantiation InstanceId="availability" InstanceName="hostName"/>
    </Resource>
</Capacity>
