<?xml version="1.0" encoding="UTF-8"?>

<Capacity xmlns:xsi="http://www.w3.org/2001/XMLSchema-instance" version="1.0" xsi:noNamespaceSchemaLocation="../../../schema/Resource.xsd">
    <GlobalMetricSetting isEncrypt="FALSE" version="4.1.0">
        <GlobalIsEdit>false</GlobalIsEdit>
        <GlobalIsMonitor>true</GlobalIsMonitor>
        <GlobalDefaultMonitorFreq>day1</GlobalDefaultMonitorFreq>
        <GlobalsupportMonitorFreq>min1,min5,min10,hour1,day1</GlobalsupportMonitorFreq>
        <GlobalIsAlert>true</GlobalIsAlert>
        <GlobalDefaultFlapping>1</GlobalDefaultFlapping>
    </GlobalMetricSetting>
    <Resource id="XenHost" category="XenHosts" icon="XenHost.png" name="Xen服务器" description="Xen服务器">
        <Metrics>
            <Metric id="availability" style="AvailabilityMetric" name="可用性" description="XenServer.主机可用性:获取自身的连接与否状态" unit="">
                <IsDisplay displayOrder="1000">true</IsDisplay>
                <IsMonitor>true</IsMonitor>
                <IsEdit>false</IsEdit>
                <DefaultMonitorFreq>min1</DefaultMonitorFreq>
                <SupportMonitorFreq>sec30,min1,min5,min10,min30,hour1</SupportMonitorFreq>
                <IsAlert>true</IsAlert>
                <DefaultFlapping>2</DefaultFlapping>
            </Metric>
            <Metric id="nameLabel" style="InformationMetric" name="服务器名称" description="服务器名称" unit="">
                <IsDisplay displayOrder="1010">true</IsDisplay>
                <IsMonitor>true</IsMonitor>
                <IsEdit>false</IsEdit>
                <DefaultMonitorFreq>hour1</DefaultMonitorFreq>
                <SupportMonitorFreq>hour1,day1</SupportMonitorFreq>
                <IsAlert>false</IsAlert>
                <DefaultFlapping>1</DefaultFlapping>
            </Metric>
            <Metric id="uuid" style="InformationMetric" name="uuid" description="uuid" unit="">
                <IsDisplay displayOrder="1020">true</IsDisplay>
                <IsMonitor>true</IsMonitor>
                <IsEdit>false</IsEdit>
                <DefaultMonitorFreq>day1</DefaultMonitorFreq>
                <SupportMonitorFreq>hour1,day1</SupportMonitorFreq>
                <IsAlert>false</IsAlert>
                <DefaultFlapping>1</DefaultFlapping>
            </Metric>
            <Metric id="hostname" style="InformationMetric" name="DNS主机名" description="DNS主机名" unit="">
                <IsDisplay displayOrder="1100">true</IsDisplay>
                <IsMonitor>true</IsMonitor>
                <IsEdit>false</IsEdit>
                <DefaultMonitorFreq>day1</DefaultMonitorFreq>
                <SupportMonitorFreq>hour1,day1</SupportMonitorFreq>
                <IsAlert>false</IsAlert>
                <DefaultFlapping>1</DefaultFlapping>
            </Metric>
            <Metric id="address" style="InformationMetric" name="地址" description="地址" unit="">
                <IsDisplay displayOrder="1110">true</IsDisplay>
                <IsMonitor>true</IsMonitor>
                <IsEdit>false</IsEdit>
                <DefaultMonitorFreq>day1</DefaultMonitorFreq>
                <SupportMonitorFreq>hour1,day1</SupportMonitorFreq>
                <IsAlert>false</IsAlert>
                <DefaultFlapping>1</DefaultFlapping>
            </Metric>
            <Metric id="sysUpTime" style="InformationMetric" name="连续运行时间" description="连续运行时间" unit="秒">
                <IsDisplay displayOrder="1120">true</IsDisplay>
                <IsMonitor>true</IsMonitor>
                <IsEdit>false</IsEdit>
                <DefaultMonitorFreq>min5</DefaultMonitorFreq>
                <SupportMonitorFreq>min1,min5,min10,min30,hour1,hour4,hour8</SupportMonitorFreq>
                <IsAlert>false</IsAlert>
                <DefaultFlapping>1</DefaultFlapping>
            </Metric>
            <Metric id="cpuRate" style="PerformanceMetric" name="CPU利用率" description="CPU利用率" unit="%">
                <IsDisplay displayOrder="1400">true</IsDisplay>
                <IsMonitor>true</IsMonitor>
                <IsEdit>false</IsEdit>
                <DefaultMonitorFreq>min5</DefaultMonitorFreq>
                <SupportMonitorFreq>min1,min5,min10,min30,hour1,hour4,hour8</SupportMonitorFreq>
                <IsAlert>false</IsAlert>
                <DefaultFlapping>1</DefaultFlapping>
                <Thresholds>
                    <Threshold operator="&lt;" defaultvalue="90" stateid="Normal"/>
                    <Threshold operator="&gt;=" defaultvalue="90" stateid="Minor"/>
                    <Threshold operator="&gt;=" defaultvalue="95" stateid="Major"/>
                </Thresholds>
            </Metric>
            <Metric id="memRate" style="PerformanceMetric" name="内存利用率" description="内存利用率" unit="%">
                <IsDisplay displayOrder="1410">true</IsDisplay>
                <IsMonitor>true</IsMonitor>
                <IsEdit>false</IsEdit>
                <DefaultMonitorFreq>min5</DefaultMonitorFreq>
                <SupportMonitorFreq>min1,min5,min10,min30,hour1,hour4,hour8</SupportMonitorFreq>
                <IsAlert>false</IsAlert>
                <DefaultFlapping>1</DefaultFlapping>
                <Thresholds>
                    <Threshold operator="&lt;" defaultvalue="90" stateid="Normal"/>
                    <Threshold operator="&gt;=" defaultvalue="90" stateid="Minor"/>
                    <Threshold operator="&gt;=" defaultvalue="95" stateid="Major"/>
                </Thresholds>
            </Metric>
            <Metric id="throughput" style="PerformanceMetric" name="吞吐量" description="吞吐量" unit="Bps">
                <IsDisplay displayOrder="1420">true</IsDisplay>
                <IsMonitor>true</IsMonitor>
                <IsEdit>false</IsEdit>
                <DefaultMonitorFreq>min5</DefaultMonitorFreq>
                <SupportMonitorFreq>min1,min5,min10,min30,hour1,hour4,hour8</SupportMonitorFreq>
                <IsAlert>false</IsAlert>
                <DefaultFlapping>1</DefaultFlapping>
                <Thresholds>
                    <Threshold operator="&lt;" defaultvalue="100" stateid="Normal"/>
                    <Threshold operator="&gt;" defaultvalue="200" stateid="Minor"/>
                    <Threshold operator="&gt;" defaultvalue="400" stateid="Major"/>
                </Thresholds>
            </Metric>
        </Metrics>
        <Properties>
            <Property id="uuid" name="uuid" metricid="uuid"/>
            <Property id="nameLabel" name="nameLabel" metricid="nameLabel"/>
        </Properties>
        <Instantiation InstanceId="uuid" InstanceName="nameLabel"/>
    </Resource>
</Capacity>
