<?xml version="1.0" encoding="UTF-8"?>
<Capacity xmlns:xsi="http://www.w3.org/2001/XMLSchema-instance" version="1.0" xsi:noNamespaceSchemaLocation="../../../schema/Resource.xsd">
    <GlobalMetricSetting>
        <GlobalIsEdit>false</GlobalIsEdit>
        <GlobalIsMonitor>true</GlobalIsMonitor>
        <GlobalDefaultMonitorFreq>day1</GlobalDefaultMonitorFreq>
        <GlobalsupportMonitorFreq>min1,min5,min10,hour1,day1</GlobalsupportMonitorFreq>
        <GlobalIsAlert>true</GlobalIsAlert>
        <GlobalDefaultFlapping>1</GlobalDefaultFlapping>
    </GlobalMetricSetting>
    <Resource id="TCPPort" category="Port" icon="port.png" name="Port" description="端口">
        <Metrics>
            <Metric id="Name" style="InformationMetric" name="端口名称" description="端口名称" unit="">
                <IsDisplay displayOrder="1000">false</IsDisplay>
                <IsMonitor>false</IsMonitor>
                <IsEdit>false</IsEdit>
                <DefaultMonitorFreq>day1</DefaultMonitorFreq>
                <SupportMonitorFreq>hour1,day1</SupportMonitorFreq>
                <IsAlert>false</IsAlert>
                <DefaultFlapping>1</DefaultFlapping>
            </Metric>
            <Metric id="ip" style="InformationMetric" name="IP地址" description="IP地址" unit="">
                <IsDisplay displayOrder="1010">true</IsDisplay>
                <IsMonitor>true</IsMonitor>
                <IsEdit>false</IsEdit>
                <DefaultMonitorFreq>day1</DefaultMonitorFreq>
                <SupportMonitorFreq>hour1,day1</SupportMonitorFreq>
                <IsAlert>false</IsAlert>
                <DefaultFlapping>1</DefaultFlapping>
            </Metric>
            <Metric id="port" style="InformationMetric" name="端口号" description="端口号" unit="">
                <IsDisplay displayOrder="1020">true</IsDisplay>
                <IsMonitor>true</IsMonitor>
                <IsEdit>false</IsEdit>
                <DefaultMonitorFreq>day1</DefaultMonitorFreq>
                <SupportMonitorFreq>hour1,day1</SupportMonitorFreq>
                <IsAlert>false</IsAlert>
                <DefaultFlapping>1</DefaultFlapping>
            </Metric>
            <Metric id="availability" style="AvailabilityMetric" name="可用性" description="可用性" unit="">
                <IsDisplay displayOrder="1030">true</IsDisplay>
                <IsMonitor>true</IsMonitor>
                <IsEdit>false</IsEdit>
                <DefaultMonitorFreq>min1</DefaultMonitorFreq>
                <SupportMonitorFreq>sec30,min1,min5,min10,min30,hour1</SupportMonitorFreq>
                <IsAlert>true</IsAlert>
                <DefaultFlapping>2</DefaultFlapping>
            </Metric>
        </Metrics>
        <Properties>
            <Property id="Name" name="Name" metricid="Name"/>
            <Property id="ip" name="ip" metricid="ip"/>
            <Property id="port" name="port" metricid="port"/>
        </Properties>
        <Instantiation InstanceId="ip,port" InstanceName="Name"/>
    </Resource>
</Capacity>
